{
  "schemaVersion": 1,
  "id": "gemini-compatible",
  "displayName": "Nano Banana / Gemini Compatible",
  "adapterKind": "gemini-compatible",
  "defaultBaseUrl": "https://generativelanguage.googleapis.com/v1beta",
  "models": [
    { "modelName": "gemini-3-pro-image-preview", "label": "Gemini 3 Pro Image Preview（官方 API 名）", "recommended": true },
    { "modelName": "gemini-2.5-flash-image", "label": "Nano Banana / Gemini 2.5 Flash Image", "recommended": false },
    { "modelName": "gemini-3.1-flash-image", "label": "Nano Banana / Gemini 3.1 Flash Image（Cookie 网页）", "recommended": false }
  ],
  "capabilities": ["textToImage", "referenceEdit", "regionEdit", "guidedRegionEdit"],
  "credential": { "kind": "profileSettings", "label": "API Key", "settingsKey": "apiKey" },
  "baseUrlHint": "Google 官方：https://generativelanguage.googleapis.com/v1beta。使用兼容服务时，请按 Key 所属平台填写完整 API 前缀。",
  "baseUrlPlaceholder": "https://generativelanguage.googleapis.com/v1beta",
  "order": 20
}
